 show databases;
+--------------------+
| Database           |
+--------------------+
| db3                |
| db4                |
| db5                |
| db6                |
| edb                |
| information_schema |
| mysql              |
| performance_schema |
| sys                |
+--------------------+
9 rows in set (0.04 sec)

Database changed
Query OK, 0 rows affected (0.51 sec)r_id int primary key auto_increment,name varchar(100),city varchar(100),credits decimal(10,2));

mysql> INSERT INTO Customer (name, city, credits) VALUES ('John', 'Delhi', 1500.50), ('Anita Nair', 'Kochi', 2300.75), ('Vikram Singh', 'Mumbai', 1800.00), ('Sneha Pillai', 'Thiruvananthapuram', 2750.25)
, ('Arjun Reddy', 'Hyderabad', 3200.00);
Query OK, 5 rows affected (0.11 sec)
Records: 5  Duplicates: 0  Warnings: 0

mysql> select * from Customer;
+-------------+--------------+--------------------+---------+
| customer_id | name         | city               | credits |
+-------------+--------------+--------------------+---------+
|           1 | John         | Delhi              | 1500.50 |
|           2 | Anita Nair   | Kochi              | 2300.75 |
|           3 | Vikram Singh | Mumbai             | 1800.00 |
|           4 | Sneha Pillai | Thiruvananthapuram | 2750.25 |
|           5 | Arjun Reddy  | Hyderabad          | 3200.00 |
+-------------+--------------+--------------------+---------+
5 rows in set (0.00 sec)


mysql> DELIMITER $$
mysql> 
mysql> CREATE PROCEDURE GetCustomerDetailsByName(IN customer_name VARCHAR(100))
    -> BEGIN
    ->     SELECT * FROM Customer
    ->     WHERE name = customer_name;
    -> END $$
Query OK, 0 rows affected (0.14 sec)

mysql> 
mysql> DELIMITER ;
mysql> call GetCustomerDetailsByName('John');
+-------------+------+-------+---------+
| customer_id | name | city  | credits |
+-------------+------+-------+---------+
|           1 | John | Delhi | 1500.50 |
+-------------+------+-------+---------+
1 row in set (0.00 sec)

Query OK, 0 rows affected (0.00 sec)


mysql> Delimiter //
mysql> CREATE PROCEDURE DetermineMembership(IN customer_credits DECIMAL(10,2),
    -> OUT membership_level VARCHAR(50))
    -> BEGIN
    -> IF customer_credits >= 5000 THEN
    -> SET membership_level = 'Membership Platinum';
    -> ELSEIF customer_credits >= 1000 THEN
    -> SET membership_level = 'Gold';
    -> ELSE
    -> SET membership_level = 'Silver';
    -> END IF;
    -> END //
Query OK, 0 rows affected (0.11 sec)

mysql> Delimiter ;

mysql> CALL DetermineMembership(6000.00, @membership1);
Query OK, 0 rows affected (0.00 sec)

mysql> CALL DetermineMembership(3500.00, @membership2);
Query OK, 0 rows affected (0.00 sec)

mysql> CALL DetermineMembership(800.00, @membership3);
Query OK, 0 rows affected (0.00 sec)

mysql> CALL DetermineMembership(10000.00, @membership4);
Query OK, 0 rows affected (0.00 sec)

mysql> 
mysql> SELECT 
    -> @membership1 AS John_Membership,
    -> @membership2 AS Alice_Membership,
    -> @membership3 AS Bob_Membership,
    -> @membership4 AS Emma_Membership;
+---------------------+------------------+----------------+---------------------+
| John_Membership     | Alice_Membership | Bob_Membership | Emma_Membership     |
+---------------------+------------------+----------------+---------------------+
| Membership Platinum | Gold             | Silver         | Membership Platinum |
+---------------------+------------------+----------------+---------------------+
1 row in set (0.00 sec)

mysql> 




CREATE TABLE Employee (emp_id INT PRIMARY KEY AUTO_INCREMENT, emp_name VARCHAR(100), department VARCHAR(100), salary DECIMAL(10,2));
Query OK, 0 rows affected (0.65 sec)
mysql> INSERT INTO Employee (emp_name, department, salary) VALUES ('John', 'HR', 30000), ('Alice', 'IT', 45000), ('Bob', 'Finance', 40000), ('John', 'Sales', 35000), ('Emma', 'IT', 50000);
Query OK, 5 rows affected (0.09 sec)
Records: 5  Duplicates: 0  Warnings: 0


mysql> delimiter //
mysql> CREATE FUNCTION CountEmployeesWithName(employee_name VARCHAR(100))
-> RETURNS INT
-> DETERMINISTIC
-> BEGIN
->     DECLARE employee_count INT;
->     SELECT COUNT(*) INTO employee_count
->     FROM Employee
->     WHERE emp_name = employee_name;
->     RETURN employee_count;
-> END //
Query OK, 0 rows affected (0.16 sec)
mysql> DELIMITER ;
mysql> SELECT CountEmployeesWithName('John');
+--------------------------------+
| CountEmployeesWithName('John') |
+--------------------------------+
|                              2 |
+--------------------------------+
1 row in set (0.00 sec)
mysql> select * from Employee;
+--------+----------+------------+----------+
| emp_id | emp_name | department | salary   |
+--------+----------+------------+----------+
|      1 | John     | HR         | 30000.00 |
|      2 | Alice    | IT         | 45000.00 |
|      3 | Bob      | Finance    | 40000.00 |
|      4 | John     | Sales      | 35000.00 |
|      5 | Emma     | IT         | 50000.00 |
+--------+----------+------------+----------+
5 rows in set (0.00 sec)
React







mysql> CREATE TABLE Emp_salary (emp_id INT PRIMARY KEY AUTO_INCREMENT, emp_name VARCHAR(100), no_of_working_days INT, designation VARCHAR(50), salary DECIMAL(10,2));
Query OK, 0 rows affected (0.69 sec)

mysql> INSERT INTO Emp_salary (emp_name, no_of_working_days, designation, salary) VALUES ('John', 22, 'Assistant Professor', 0), ('Alice', 20, 'Programmer', 0), ('Bob', 25, 'Clerk', 0), ('Emma', 18, 'Designer', 0), ('David', 24, 'Programmer', 0);
Query OK, 5 rows affected (0.14 sec)
Records: 5  Duplicates: 0  Warnings: 0

mysql> DELIMITER //
mysql> CREATE PROCEDURE CalculateEmployeeSalary()
    -> BEGIN
    ->     DECLARE done INT DEFAULT FALSE;
    ->     DECLARE emp_id_val INT;
    ->     DECLARE emp_name_val VARCHAR(100);
    ->     DECLARE working_days_val INT;
    ->     DECLARE designation_val VARCHAR(100);
    ->     DECLARE daily_wage DECIMAL(10,2);
    ->     DECLARE emp_salary DECIMAL(10,2);
    ->     DECLARE emp_cursor CURSOR FOR
    ->         SELECT emp_id, emp_name, no_of_working_days, designation
    ->         FROM Emp_salary;
    ->     DECLARE CONTINUE HANDLER FOR NOT FOUND SET done = TRUE;
    -> 
    ->     OPEN emp_cursor;
    -> 
    ->     emp_loop: LOOP
    ->         FETCH emp_cursor INTO emp_id_val, emp_name_val, working_days_val, designation_val;
    -> 
    ->         IF done THEN
    ->             LEAVE emp_loop;
    ->         END IF;
    ->         CASE designation_val
    ->             WHEN 'Assistant Professor' THEN SET daily_wage = 1750.00;
    ->             WHEN 'Clerk' THEN SET daily_wage = 750.00;
    ->             WHEN 'Programmer' THEN SET daily_wage = 1250.00;
    ->             ELSE SET daily_wage = 0.00;
    ->         END CASE;
    -> 
    ->         SET emp_salary = working_days_val * daily_wage;
    -> 
    ->         UPDATE Emp_salary
    ->         SET salary = emp_salary
    ->         WHERE emp_id = emp_id_val;
    -> 
    ->     END LOOP;
    -> 
    ->     CLOSE emp_cursor;
    -> END //
Query OK, 0 rows affected (0.11 sec)

mysql> DELIMITER ;
mysql> CALL CalculateEmployeeSalary();
Query OK, 0 rows affected (0.48 sec)

mysql> CALL CalculateEmployeeSalary();
Query OK, 0 rows affected (0.00 sec)

mysql> SELECT * FROM Emp_salary;
+--------+----------+--------------------+---------------------+----------+
| emp_id | emp_name | no_of_working_days | designation         | salary   |
+--------+----------+--------------------+---------------------+----------+
|      1 | John     |                 22 | Assistant Professor | 38500.00 |
|      2 | Alice    |                 20 | Programmer          | 25000.00 |
|      3 | Bob      |                 25 | Clerk               | 18750.00 |
|      4 | Emma     |                 18 | Designer            |     0.00 |
|      5 | David    |                 24 | Programmer          | 30000.00 |
+--------+----------+--------------------+---------------------+----------+
5 rows in set (0.01 sec)




mysql> CREATE TABLE Bill (customer_id INT PRIMARY KEY AUTO_INCREMENT, name VARCHAR(100), pre_reading INT, cur_reading INT, unit INT, amount DECIMAL(10,2));
Query OK, 0 rows affected (0.98 sec)

mysql> INSERT INTO Bill (name, pre_reading, cur_reading, unit, amount) VALUES ('Rahul', 1000, 1100, 0, 0), ('Anita', 1500, 1700, 0, 0), ('Vikram', 2000, 2350, 0, 0), ('Sneha', 500, 900, 0, 0), ('Arjun', 1200, 1400, 0, 0);
Query OK, 5 rows affected (0.28 sec)
Records: 5  Duplicates: 0  Warnings: 0

mysql> Delimiter //
mysql> CREATE PROCEDURE CalculateElectricityBill()
    -> BEGIN
    ->     DECLARE customer_id_val INT;
    ->     DECLARE name_val VARCHAR(100);
    ->     DECLARE pre_reading_val INT;
    ->     DECLARE cur_reading_val INT;
    ->     DECLARE unit_val INT;
    ->     DECLARE amount_val DECIMAL(10,2);
    ->     DECLARE done INT DEFAULT FALSE;
    ->     
    ->     DECLARE bill_cursor CURSOR FOR
    ->         SELECT customer_id, name, pre_reading, cur_reading
    ->         FROM Bill;
    ->     
    ->     DECLARE CONTINUE HANDLER FOR NOT FOUND SET done = TRUE;
    ->     
    ->     OPEN bill_cursor;
    ->     
    ->     bill_loop: LOOP
    ->         FETCH bill_cursor INTO customer_id_val, name_val, pre_reading_val, cur_reading_val;
    ->         
    ->         IF done THEN
    ->             LEAVE bill_loop;
    ->         END IF;
    ->         
    ->         SET unit_val := cur_reading_val - pre_reading_val;
    ->         
    ->         IF unit_val <= 100 THEN
    ->             SET amount_val := unit_val * 2.00;
    ->         ELSEIF unit_val <= 200 THEN
    ->             SET amount_val := 100 * 2.00 + (unit_val - 100) * 2.50;
    ->         ELSEIF unit_val <= 300 THEN
    ->             SET amount_val := 100 * 2.00 + 100 * 2.50 + (unit_val - 200) * 3.00;
    ->         ELSE
    ->             SET amount_val := 100 * 2.00 + 100 * 2.50 + 100 * 3.00 + (unit_val - 300) * 4.00;
    ->         END IF;
    ->         
    ->         UPDATE Bill
    ->         SET amount = amount_val
    ->         WHERE customer_id = customer_id_val;
    ->     END LOOP;
    ->     
    ->     CLOSE bill_cursor;
    -> END //
Query OK, 0 rows affected (0.15 sec)

mysql> delimiter ;
mysql> CALL CalculateElectricityBill();
Query OK, 0 rows affected (0.57 sec)

mysql> SELECT * FROM Bill;
+-------------+--------+-------------+-------------+------+---------+
| customer_id | name   | pre_reading | cur_reading | unit | amount  |
+-------------+--------+-------------+-------------+------+---------+
|           1 | Rahul  |        1000 |        1100 |    0 |  200.00 |
|           2 | Anita  |        1500 |        1700 |    0 |  450.00 |
|           3 | Vikram |        2000 |        2350 |    0 |  950.00 |
|           4 | Sneha  |         500 |         900 |    0 | 1150.00 |
|           5 | Arjun  |        1200 |        1400 |    0 |  450.00 |
+-------------+--------+-------------+-------------+------+---------+
5 rows in set (0.00 sec)




CREATE TABLE Emp_history (
    ->     employee_id INT,
    ->     name VARCHAR(100),
    ->     department VARCHAR(100),
    ->     salary DECIMAL(10,2),
    ->     date_of_deletion DATETIME,
    ->     UNIQUE(employee_id)  -- ensures one record per employee
    -> );
    

Query OK, 0 rows affected (0.59 sec)

mysql> DROP TRIGGER IF EXISTS MoveDeletedEmployeeToHistory;
    -

Query OK, 0 rows affected, 1 warning (0.04 sec)

mysql> DELIMITER //
mysql> CREATE TRIGGER MoveDeletedEmployeeToHistory
    -> AFTER DELETE ON Employee
    -> FOR EACH ROW
    -> BEGIN
    ->     -- Insert into history, ignore if employee_id already exists
    ->     INSERT IGNORE INTO Emp_history (employee_id, name, department, salary, date_of_deletion)
    ->     VALUES (OLD.emp_id, OLD.emp_name, OLD.department, OLD.salary, NOW());
    -> END //
Query OK, 0 rows affected (0.14 sec)

mysql> 
mysql> DELIMITER ;

mysql> DELETE FROM Employee WHERE emp_id = 2;
Query OK, 0 rows affected (0.01 sec)

mysql> 

mysql> DELETE FROM Employee WHERE emp_id = 3;
Query OK, 1 row affected (0.10 sec)

mysql> SELECT * FROM Emp_history;
+-------------+------+------------+----------+---------------------+
| employee_id | name | department | salary   | date_of_deletion    |
+-------------+------+------------+----------+---------------------+
|           3 | Bob  | Finance    | 40000.00 | 2026-03-26 14:48:20 |
+-------------+------+------------+----------+---------------------+
1 row in set (0.00 sec)


